"#",Jurisdiction,Kind,Display Key,Lens ID,Publication Date,Publication Year,Application Number,Application Date,Priority Numbers,Earliest Priority Date,Title,Abstract,Applicants,Inventors,Owners,URL,Document Type,Has Full Text,Cites Patent Count,Cited by Patent Count,Simple Family Size,Simple Family Members,Simple Family Member Jurisdictions,Extended Family Size,Extended Family Members,Extended Family Member Jurisdictions,Sequence Count,CPC Classifications,IPCR Classifications,US Classifications,NPL Citation Count,NPL Resolved Citation Count,NPL Resolved Lens ID(s),NPL Resolved External ID(s),NPL Citations,Legal Status
1,CN,A,CN 118628251 A,180-863-083-505-427,2024-09-10,2024,CN 202410419929 A,2024-04-09,CN 202410419929 A,2024-04-09,Parent fund investment management system of intelligent large language model based on GPT,"The invention provides a parent fund investment management system based on a GPT intelligent large language model, and the system comprises a parent fund investment management module which is used for carrying out the whole-process management of a project, including the collection, analysis and processing of investment data, and helping an investor make an investment decision; the parent fund investment management module comprises a plurality of process modules; and the mother fund decision investment support module is used for automatically responding to the requirements of each flow of the mother fund investment management module, constructing a prompt input by the GPT model at different flow stages of the mother fund investment management module, feeding back a processing result of the GPT model to the mother fund investment management module, and optimizing the intelligent investment capability of the mother fund investment management module. By embedding the mother fund decision investment support module in the mother fund investment management system, the investment process is optimized, the system operation is more intelligent and automatic, comprehensive information integration is realized, the data processing efficiency is improved, the complete scheduling time is shortened, the investment efficiency is improved, the overall performance of the mother fund investment management system is improved, and the risk is reduced. And more reliable support is provided for investment decision making.",CHINA SHIPPING SERVICE INFORMATION TECH CO LTD,ZHU ZHENGXIONG;;ZHOU ZHIHONG;;PAN HAIJIN;;WEN XIAONAN;;LIU YUCONG,,https://lens.org/180-863-083-505-427,Patent Application,no,0,0,1,180-863-083-505-427,CN,1,180-863-083-505-427,CN,0,G06Q40/06;;G06Q10/103;;G06N3/0455,G06Q40/06;;G06N3/0455;;G06Q10/10,,0,0,,,,PENDING
2,CN,A,CN 119090534 A,145-502-813-078-306,2024-12-06,2024,CN 202411203806 A,2024-08-30,CN 202411203806 A,2024-08-30,Personalized investment recommendation system based on large language model,"The invention discloses a personalized investment recommendation system based on a large language model, which optimizes an investment strategy and ensures the diversity and personalization of an investment portfolio by identifying new investment factors in a market and generating a personalized factor combination according to the investment style, market preference and risk tolerance of a user. Meanwhile, the analysis and evaluation module generates market emotion indexes through emotion analysis of financial news, social media information and company announcements. The emotion index increases consideration of an emotion level for investment suggestions, so that an investment decision is not only based on rational data analysis, but also can reflect emotional fluctuation of the market. Through the synergistic effect of the two modules, the recommendation system can provide more accurate and dynamically adaptive investment suggestions, and the requirements of users and the actual dynamic state of the market are better met.",HEBEI FINANCE UNIV;;BAODING YANHU NETWORK TECH CO LTD,ZHANG YAO;;LIU CHONG,,https://lens.org/145-502-813-078-306,Patent Application,no,0,2,1,145-502-813-078-306,CN,1,145-502-813-078-306,CN,0,G06Q30/0201;;G06Q40/06;;G06F16/9535;;G06F40/242;;G06F40/30;;G06F18/214;;G06F18/217,G06Q30/0201;;G06F16/9535;;G06F18/21;;G06F18/214;;G06F40/242;;G06F40/30;;G06Q40/06,,0,0,,,,DISCONTINUED
3,CN,A,CN 120781845 A,095-958-790-461-620,2025-10-14,2025,CN 202510974206 A,2025-07-15,CN 202510974206 A,2025-07-15,Financial data management system based on large language model,"The invention provides a financial data management system based on a big language model, relates to the technical field of financial data management, and aims to provide a financial data management system based on the big language model by performing semantic analysis and access feature extraction on a financial data access request based on the big language model and combining with a fluctuation trend of a data reading popularity curve. Dynamic division of data access hierarchies is realized through a spectral clustering algorithm, and time-phased preloading is performed by adopting a dynamic statistical cycle model. Therefore, the accuracy and efficiency of data access can be improved, the resource scheduling of the server can be optimized, intelligent management of financial data can be realized in a high-concurrency scene, the load of the server can be reduced, and the overall performance and response capability of the system can be improved.",BEIJING JINDAO TIANCHENG INFORMATION SYSTEM SERVICE CO LTD,LING YANG;;CHEN CHENG;;TAO LETIAN;;CHEN QIANKAI;;YE YANQING,,https://lens.org/095-958-790-461-620,Patent Application,no,3,0,1,095-958-790-461-620,CN,1,095-958-790-461-620,CN,0,Y02D10/00,G06F40/30;;G06F17/18;;G06F18/23;;G06N3/045;;G06N3/08;;G06Q40/12,,1,0,,,"王飞 等: ""一种面向相似查询的轨迹索引方法"", 计算机应用与软件, vol. 34, no. 11, 15 November 2017 (2017-11-15), pages 1 - 5",PENDING
4,CN,A,CN 120598644 A,044-695-070-552-311,2025-09-05,2025,CN 202510756783 A,2025-06-09,CN 202510756783 A,2025-06-09,Financial fraud detection method based on large language model,"The invention provides a financial fraud detection method based on a large language model. The method comprises the steps of obtaining a to-be-recognized text; performing word segmentation on the to-be-recognized text through the target word segmentation tool and the financial fraud dictionary, and determining a fraud sensitive word list; calculating the weight of each sensitive word in the sensitive word list according to a target algorithm to obtain a sensitive word weight feature vector; inputting the sensitive word weight feature vector and a to-be-recognized text into a large language model, and determining a context semantic vector of the sensitive word in combination with a word embedding technology; determining the similarity between the context semantic vector of the sensitive word and a preset financial fraud type semantic vector; and determining a financial fraud type according to the similarity. Through the implementation of the method, the generalization ability of the pre-training model is utilized to capture text deep semantics, priori knowledge is injected in combination with a sensitive word weight mechanism, the model is guided to focus high-risk vocabularies, the defect of a traditional method in semantic comprehension is overcome, the financial fraud recognition rate is increased, and the omission ratio is reduced.",UNIV CHONGQING TECHNOLOGY,WU JINGRU;;TAN FUWEN;;LEI XUEMEI;;JIANG YUAN;;ZENG XIAOTONG;;HE TAO;;YANG NING;;ZHANG LING;;LIU SHUYUAN;;DONG YACHAO,,https://lens.org/044-695-070-552-311,Patent Application,no,0,1,1,044-695-070-552-311,CN,1,044-695-070-552-311,CN,0,,G06Q40/00;;G06F40/216;;G06F40/242;;G06F40/289;;G06F40/30;;G06N3/045,,0,0,,,,PENDING
5,CN,A,CN 119906867 A,085-926-810-402-988,2025-04-29,2025,CN 202411821964 A,2024-12-11,CN 202411821964 A,2024-12-11,Financial news editing method based on large language model,"The invention relates to the technical field of news collection and editing, in particular to a financial news editing method based on a large language model, which comprises the following steps: processing original video content by using a hybrid expert model to obtain video segment information; splitting according to the video segmentation information to obtain segmented videos; acquiring news materials to be processed, inputting the news materials to the hybrid expert model, generating text editing contents according to the content abstract, and matching the segmented videos to form contents to be organized; and forming and outputting an edited manuscript according to the to-be-organized content. Aiming at the problem that a news auxiliary processing scheme in the prior art can only process text news contents, the method comprises the following steps of: firstly splitting original video contents to obtain segmented videos corresponding to different expression semantics, and inputting news materials of to-be-processed texts into a hybrid expert model on the basis, so as to extract content abstracts; and the segmented videos are matched and organized, so that the processing efficiency of the multimedia news is improved.",SHANGHAI FIRST FINANCIAL MEDIA CO LTD,YAO XUERUN;;ZHANG QI;;NI MINGHAO;;XIONG SHENGHUA;;SHAN WENHUO;;MIN XIAOXIANG;;CHEN XIAOJIAN;;MA JUNSHENG,,https://lens.org/085-926-810-402-988,Patent Application,no,0,0,1,085-926-810-402-988,CN,1,085-926-810-402-988,CN,0,H04N21/47205;;H04N21/8456;;G06F16/2433;;G06F16/245,H04N21/472;;G06F16/242;;G06F16/245;;H04N21/845,,0,0,,,,PENDING
6,CN,A,CN 119378660 A,002-745-736-476-343,2025-01-28,2025,CN 202411514598 A,2024-10-29,CN 202411514598 A,2024-10-29,Large language model knowledge graph construction method in financial field,"The invention discloses a big language model knowledge graph construction method in the financial field, which performs relation extraction by introducing a deep learning algorithm, and integrates and verifies financial data from different data sources by using a field ontology and an inference engine. The problem of data integration caused by inconsistent data formats, entity redundancy and conflicts in a traditional method is solved, so that the accuracy and consistency of knowledge graph construction are greatly improved. According to the method, the problems caused by non-uniform names or data redundancy in different financial institutions, market reports and government files can be effectively eliminated, the calculation complexity is reduced, and the query efficiency is improved. And secondly, an intelligent question-answering system based on a natural language is introduced, so that the technical threshold of the user is reduced, and non-technical personnel can query and analyze financial data without mastering a complex query language.",HEBEI FINANCE UNIV;;BAODING NUOSEN COMPUTER SOFTWARE DEV CO LTD,LIU CHONG;;ZHANG YAO;;WANG MEI;;PANG HAO,,https://lens.org/002-745-736-476-343,Patent Application,no,0,5,1,002-745-736-476-343,CN,1,002-745-736-476-343,CN,0,G06N5/02;;G06N5/04;;G06F16/3344;;G06F16/35;;G06F16/367;;G06F16/3329;;G06N3/0442;;G06N3/048;;G06N3/084;;G06F40/295,G06N5/02;;G06F16/33;;G06F16/332;;G06F16/35;;G06F16/36;;G06F40/295;;G06N3/0442;;G06N3/048;;G06N3/084;;G06N5/04,,0,0,,,,PENDING
7,CN,A,CN 120634701 A,174-817-188-189-032,2025-09-12,2025,CN 202510498688 A,2025-04-21,CN 202510498688 A,2025-04-21,Financial risk assessment method and device based on large language model,"The invention discloses a financial risk assessment method and device based on a large language model. The method comprises the following steps: acquiring historical data of a user and external scene variable data, and preprocessing the acquired historical data of the user; constructing an input vector according to the preprocessed historical data of the user and the external scene variable data; using a large language model to generate a user future behavior sequence based on a condition generation technology; adding a time dimension into the future behavior sequence of the user to obtain dynamic change data of the user behavior along with time t; and obtaining a risk feature mean value based on the dynamic change number of the user behavior along with the time t, and calculating a comprehensive risk score through weighted summation. According to the method, the large language model is applied to financial user behavior prediction, the future behavior sequence of the user under the external scene variable is generated through the condition generation technology, and the scientificity and accuracy of risk assessment are improved.",JIANGSU SUSHANG BANK CO LTD,SHI ZHIHUI,,https://lens.org/174-817-188-189-032,Patent Application,no,0,0,1,174-817-188-189-032,CN,1,174-817-188-189-032,CN,0,,G06Q40/03;;G06N5/04,,0,0,,,,PENDING
8,CN,A,CN 120125366 A,092-630-144-587-909,2025-06-10,2025,CN 202510194202 A,2025-02-21,CN 202510194202 A,2025-02-21,Large language model prediction and evaluation method for financial statement analysis,"The invention discloses a large language model prediction and evaluation method for financial statement analysis. The method comprises the following steps: collecting and arranging original financial statement data; anonymization processing and standardization processing are sequentially carried out on the financial statement data; designing a structured thinking chain prompt based on the financial statement data after anonymization processing and standardization processing; inputting the financial statement data subjected to anonymization processing and standardization processing and the thinking chain prompt into a large language model, so that the large language model performs prediction according to the thinking chain prompt; the prediction result output by the large language model is evaluated from multiple dimensions, if the evaluation result of each dimension is within a set error range, an analysis report is generated according to the prediction result, and otherwise, the designed thinking chain prompt is optimized. According to the method, the data processing efficiency is improved, the analysis dimension and depth are improved, and the subjectivity and consistency in analysis are improved.",JIANGSU VOCATIONAL COLLEGE FINANCE & ECONOMICS,WANG HAO,,https://lens.org/092-630-144-587-909,Patent Application,no,0,1,1,092-630-144-587-909,CN,1,092-630-144-587-909,CN,0,G06Q40/125;;G06Q40/06;;G06Q10/06393;;G06N20/00,G06Q40/12;;G06N20/00;;G06Q10/0639;;G06Q40/06,,0,0,,,,PENDING
9,CN,A,CN 120124593 A,123-505-505-719-525,2025-06-10,2025,CN 202510595300 A,2025-05-09,CN 202510595300 A,2025-05-09,Financial statement automatic analysis system based on large language model,"The invention discloses a financial statement automatic analysis system based on a large language model. The financial statement automatic analysis system comprises a financial analysis DSL generation large model, a financial analysis DSL filter and a financial analysis DSL decoder. When the system receives at least one financial statement analysis request in a natural language form, a financial analysis DSL primary script is automatically generated by a financial analysis DSL generation large model, the primary script is input into a financial analysis DSL filter to obtain a financial analysis DSL complete script, then the complete script is input into a financial analysis DSL decoder to be decoded, and the financial statement analysis request is sent to the financial analysis DSL decoder. And obtaining a prompt text containing a financial analysis result and a knowledge text, and returning financial analysis and explanation to a user interface in a plain text form by the inference model. According to the financial statement automatic analysis system based on the large language model, the financial analysis report of the natural language request is automatically generated, and the efficiency and accuracy of financial statement analysis are remarkably improved.",UNIV ZHEJIANG,CHEN JUN;;XU JING;;ZHAN LIBIN;;WU FEI;;DONG WANG;;WANG WENMING;;GONG QIHUI,,https://lens.org/123-505-505-719-525,Patent Application,no,10,0,2,152-031-789-934-816;;123-505-505-719-525,CN,2,152-031-789-934-816;;123-505-505-719-525,CN,0,G06F40/16;;G06N5/041;;G06N3/0455;;G06N3/0475;;G06F40/295;;G06N3/043,G06F40/16;;G06F40/295;;G06N3/043;;G06N3/0455;;G06N3/0475;;G06N5/04,,2,0,,,"浙江大学: ""浙大管院发布交叉研究新成果，首个开源财会大模型问世"", Retrieved from the Internet <URL:http://www.som.zju.edu.cn/2024/0709/c63473a2944686/page.htm>;;WENTAO YE: ""Tablegpt2: A large multimodal model with tabular data integration"", Retrieved from the Internet <URL:https://arxiv.org/pdf/2411.02059>",ACTIVE
10,CN,A,CN 119809844 A,139-632-602-616-061,2025-04-11,2025,CN 202510293844 A,2025-03-13,CN 202510293844 A,2025-03-13,Financial data deep analysis method based on large language model,"The invention relates to the technical field of financial data analysis, in particular to a financial data deep analysis method based on a large language model. Collecting historical financial data and historical news data of the target enterprise; identifying the historical financial data to obtain an associated enterprise having financial contact with the target enterprise; performing deep analysis on the historical financial data, and performing identification to obtain financial association feature data of the associated enterprise and the target enterprise; identifying news data related to the target enterprise and the associated enterprise in the historical news data to obtain financial associated news data; identifying the financial associated news data to obtain financial news feature data; and performing model training through the financial association feature data, the financial news feature data and the historical financial data to obtain a financial association analysis model. According to the method, the real-time news data is collected and identified through the financial association analysis model, and the financial prediction data is accurately obtained.",ZHEJIANG FULIN TECH CO LTD,TANG KEWEI;;CHEN SHENGHONG;;QIU PENGFEI,,https://lens.org/139-632-602-616-061,Patent Application,no,5,0,2,129-533-270-212-856;;139-632-602-616-061,CN,2,129-533-270-212-856;;139-632-602-616-061,CN,0,,G06Q40/12;;G06F18/20,,0,0,,,,ACTIVE
11,CN,A,CN 119398954 A,159-182-870-096-197,2025-02-07,2025,CN 202510008994 A,2025-01-03,CN 202510008994 A,2025-01-03,Financial data management system based on large language model assistance,"The invention relates to the technical field of financial data management, and particularly discloses a financial data management system based on large language model assistance, which processes a financial report file by using a natural language technology based on deep learning, extracts text content in the financial report file, and performs word granularity semantic coding on the text content to obtain a semantic coding result; the method comprises the following steps of: acquiring a semantic meaning of each word granularity description in a financial report, performing semantic association enhancement based on local context on each word granularity description semantic feature of the financial report to enhance the semantic feature expression capability of each word granularity description, and performing financial term annotation by means of a large language model on the basis. And based on the financial term annotation information, performing automatic financial report structured database recording on the financial report text content. In this way, the financial report processing efficiency and accuracy can be remarkably improved, meanwhile, manual errors are reduced, and a more accurate financial analysis tool is provided for investors and supervision organizations.",SHANGHAI MICROPORT SOFTWARE CO LTD,NIU GUOLEI;;SHEN YAWEI;;GONG YANYAN,,https://lens.org/159-182-870-096-197,Patent Application,no,2,1,1,159-182-870-096-197,CN,1,159-182-870-096-197,CN,0,G06Q40/125;;G06F40/30,G06Q40/12;;G06F40/30,,0,0,,,,PENDING
12,CN,A,CN 119444260 A,183-297-045-731-066,2025-02-14,2025,CN 202411499352 A,2024-10-25,CN 202411499352 A,2024-10-25,Intelligent financial consultation system and method based on large language model,"The invention discloses an intelligent financial consultation system and method based on a large language model, and the system comprises the steps: receiving a multi-mode financial consultation request of a customer, analyzing the input of the customer through the natural language processing and computer vision technology, extracting key information and intention, and dynamically constructing and updating a customer portrait. And specific requirements of clients can be accurately identified. And after the identified demands are stored in a problem database, the system performs real-time analysis on historical data, market dynamics and customer behaviors by using a machine learning algorithm, thereby automatically identifying and predicting potential demands and market trends of customers. Afterwards, on the basis of the prediction results, the system uses a large language model to generate personalized and multi-dimensional financial suggestions, including different risk levels and profit expectations, so as to help customers to make better decisions.",HEBEI FINANCE UNIV;;BAODING NUOSEN COMPUTER SOFTWARE DEV CO LTD,LIU CHONG;;ZHANG YAO;;YANG ZHAOTING;;PANG HAO,,https://lens.org/183-297-045-731-066,Patent Application,no,0,1,1,183-297-045-731-066,CN,1,183-297-045-731-066,CN,0,G06Q30/0281;;G06Q40/06;;G06F16/3329;;G06F16/3344;;G06N20/00,G06Q30/02;;G06F16/3329;;G06F16/334;;G06N20/00;;G06Q40/06,,0,0,,,,PENDING
13,CN,A,CN 119205353 A,170-373-018-940-241,2024-12-27,2024,CN 202411321843 A,2024-09-23,CN 202411321843 A,2024-09-23,Automobile financial service method and system based on large language model,"The invention relates to the technical field of automobile finance, in particular to an automobile finance service method and system based on a big language model, and the method comprises the following steps: based on the transaction application information of a customer, analyzing the loan and lease application information of the customer through the big language model, and recognizing and recording the basic information and financial data of the customer; a customer information dataset is generated. According to the invention, batch data is automatically processed by using a large language model, the examination and approval time is reduced, the processing efficiency is improved, key financial data is extracted, the comprehensiveness and accuracy of customer credit evaluation are improved by combining historical repayment records of customers and the use frequency of credit cards, and through real-time monitoring of transaction behaviors and data-driven market analysis, the customer credit evaluation efficiency is improved. According to the method, abnormal transactions and fraudulent behaviors are quickly identified, financial risks are prevented in advance, and market adaptability and customer satisfaction of financial services are improved by predicting market trends and seasonal changes, adjusting loan, lease and insurance parameters and matching market and customer demands.",SICHUAN WANWANG XINCHENG INFORMATION TECH CO LTD,LIU MINGSHUN;;CHEN XINWEI;;WANG MINGJUN,,https://lens.org/170-373-018-940-241,Patent Application,no,8,0,1,170-373-018-940-241,CN,1,170-373-018-940-241,CN,0,G06Q40/06;;G06Q40/03;;G06Q40/04;;G06Q40/125;;G06Q10/10;;G06Q30/0201;;G06Q30/0645,G06Q40/06;;G06Q10/10;;G06Q30/0201;;G06Q30/0645;;G06Q40/03;;G06Q40/04;;G06Q40/12,,0,0,,,,PENDING
14,CN,A,CN 119046416 A,070-650-137-609-145,2024-11-29,2024,CN 202410992103 A,2024-07-23,CN 202410992103 A,2024-07-23,Financial financing planning scheme providing system based on large language model,"The invention provides a financial financing planning scheme providing system based on a large language model, and the system improves the accuracy and efficiency of processing financial planning problems by constructing a training data set in the financial field, finely adjusting a basic large language model and designing a retrieval enhancement generation component. According to the method, fine tuning training is carried out on a basic large language model by adopting a low-order adaptive technology, and a model weight special for the financial field is provided for a system. According to the method, a retrieval enhancement generation component is designed, an existing knowledge document of a financial platform is segmented, encoded and stored in a vector knowledge base, after a user initiates a demand, a system calls the retrieval enhancement generation component to obtain related knowledge base content, and an accurate financing planning suggestion is generated in combination with the input demand. A data set, a large language model and a retrieval component are continuously optimized by designing a benchmark index. According to the system, a real-time and accurate financing planning scheme can be provided when complex problems in the financial field are processed, and the user experience and satisfaction are remarkably improved.",CHENGDU JIAOZI SHUQI TECH CO LTD,YE MAO;;PU DAN;;RAN JIAXIN;;CHEN YUXIA;;LIU XIANG;;HE YIJUAN;;WANG ZHAO;;DENG YIZHOU;;DOU ZHI;;TIAN YOUJING,,https://lens.org/070-650-137-609-145,Patent Application,no,0,5,1,070-650-137-609-145,CN,1,070-650-137-609-145,CN,0,G06F16/3329;;G06F16/3344;;G06F40/30;;G06F40/35;;G06F40/268;;G06F40/289;;G06F40/295;;G06F18/22;;G06Q40/06;;G06N3/0455;;G06N3/084;;G06N5/041,G06F16/332;;G06F16/33;;G06F18/22;;G06F40/268;;G06F40/289;;G06F40/295;;G06F40/30;;G06F40/35;;G06N3/0455;;G06N3/084;;G06N5/04;;G06Q40/06,,0,0,,,,PENDING
