29,CN,A,CN 119293251 A,158-730-133-243-175,2025-01-10,2025,CN 202411798209 A,2024-12-09,CN 202411798209 A,2024-12-09,Financial user emotion and psychological portrait analysis method based on large language model,"The invention discloses a financial user emotion and psychological portrait analysis method based on a large language model. The method comprises the steps of collecting user text data; preprocessing the collected user text data; performing sentiment analysis and psychological feature modeling on the user text data by using a large language model to obtain a sentiment feature vector and a psychological feature vector of the user; combining the emotion feature vector and the psychological feature vector of the user with a risk scoring model to generate a comprehensive risk score; and the user portrait and the risk score are visually displayed through a visual means. According to the method, the non-structured data and the structured data are combined, sentence-by-sentence sentiment classification and psychological feature modeling are performed on the user text data by adopting the large language model, unified feature processing and user portrait generation are realized, the integrity and multi-dimensional coverage capability of the user portrait are remarkably improved, and a more reliable basis is provided for risk assessment.",JIANGSU SUSHANG BANK CO LTD,SHI ZHIHUI,,https://lens.org/158-730-133-243-175,Patent Application,no,5,0,2,158-730-133-243-175;;175-332-757-621-026,CN,2,158-730-133-243-175;;175-332-757-621-026,CN,0,G06F16/35;;G06F40/247;;G06F18/253;;G06F18/10;;Y02D10/00,G06F16/353;;G06F18/10;;G06F18/25;;G06F40/247,,1,0,,,"彭倩: ""金融教育、投资经验与投资者非理性行为研究"", 《中国优秀硕士学位论文全文数据库(电子期刊) 经济与管理科学辑》, no. 02, 15 February 2023 (2023-02-15)",ACTIVE
30,CN,A,CN 120198231 A,066-978-857-531-707,2025-06-24,2025,CN 202510668040 A,2025-05-23,CN 202510668040 A,2025-05-23,Financial risk intelligent early warning system and method based on large language model,"The invention discloses a financial risk intelligent early warning system and method based on a large language model. The system comprises a data integration module, a real-time task scheduling engine, a data preprocessing unit, a large language model analysis module, a comprehensive evaluation module and an early warning module. Data collected by the data integration module is integrated by a real-time task scheduling engine and then transmitted to the data preprocessing unit, data processed by the data preprocessing unit is transmitted to the large language model analysis module, and an analysis result of the large language model analysis module is transmitted to the comprehensive evaluation module. The comprehensive risk score of the comprehensive evaluation module is transmitted to the early warning module. By efficiently processing mass data, multi-dimensional risk identification and deep understanding are realized, financial market dynamics are monitored in real time, potential risk signals are quickly captured, and accurate and comprehensive risk assessment is provided for financial institutions. The system has real-time performance and a dynamic response mechanism, risk prompts are automatically generated, investors are assisted to flexibly adjust strategies, and potential losses are reduced.",SHENZHEN YINGSHISHENG INFORMATION TECH CO LTD,TANG QIU;;LI YUEFENG;;WANG MIAO,,https://lens.org/066-978-857-531-707,Patent Application,no,5,0,1,066-978-857-531-707,CN,1,066-978-857-531-707,CN,0,G06Q40/06;;G06F18/2431;;G06F18/256;;G06N5/04;;G06F18/10;;G06F16/116;;G08B31/00,G06Q40/06;;G06F16/11;;G06F18/10;;G06F18/2431;;G06F18/25;;G06N5/04;;G08B31/00,,3,0,,,"刘震: ""《数智化革命 价值驱动的产业数字化转型》"", 28 February 2022, 机械工业出版社, pages: 140;;郭畅等: ""《大数据技术》"", 31 January 2022, 中国商业出版社, pages: 311;;蒋宁等: ""《金融大模型 揭示数字金融领域大模型的应用与发展趋势 精装典藏版》"", 31 March 2024, 中国科学技术出版社, pages: 082 - 083",PENDING
31,CN,A,CN 119831751 A,084-799-389-724-469,2025-04-15,2025,CN 202411886996 A,2024-12-20,CN 202411886996 A,2024-12-20,"Automobile financial service optimization method, system and equipment based on large language model","The invention discloses an automobile financial service optimization method, system and device based on a large language model. The method comprises the steps of obtaining a first text input by a first user; inputting the first text into the large language model to obtain a first financial scheme; obtaining a second text input by the first user; obtaining a first evaluation for the first financial scheme in the second text; obtaining first transaction data of the first user, and clustering the first user according to the first transaction data and the first evaluation to obtain a clustering result; establishing a transaction prediction model according to a clustering result; obtaining dialogue data to be detected, and obtaining future transaction prediction data according to the dialogue data to be detected and the transaction prediction model; and optimizing the financial scheme according to the future transaction prediction data. The problems that an existing automobile financial service financial scheme is slow in feedback response to markets and users, slow in perception of user demand changes and insufficient in accuracy are at least solved.",SICHUAN WANWANG XINCHENG INFORMATION TECH CO LTD,LIU MINGSHUN;;HUANG YONG;;CHEN XINWEI;;WANG MINGJUN,,https://lens.org/084-799-389-724-469,Patent Application,no,8,0,1,084-799-389-724-469,CN,1,084-799-389-724-469,CN,0,Y02T10/40,G06Q40/06;;G06F16/332;;G06F16/3329;;G06F18/2321;;G06N5/04;;G06Q40/04,,0,0,,,,PENDING
32,CN,A,CN 119940299 A,060-175-261-480-833,2025-05-06,2025,CN 202510061476 A,2025-01-15,CN 202510061476 A,2025-01-15,Financial statement balance verification automation method and device based on large language model,"The invention provides a financial statement balance verification automation method based on a large language model. The method comprises the steps that S1, a table custom format conversion module is constructed; s2, constructing a typical sample library; s3, constructing a table verification information generation module; s4, connecting character calculators in series; step S5, generating a verification report; and S6, carrying out confidence coefficient test and dynamically updating the typical sample library. According to the method, the semantic understanding and numerical value verification accuracy of the table can be improved, efficient field adaptability is achieved, automatic report generation is achieved, user friendliness is achieved, and the enterprise management efficiency can be improved.",UNIV SCIENCE & TECHNOLOGY CHINA,LIN QIANYE;;SONG YANZHI;;YANG ZHOUWANG,,https://lens.org/060-175-261-480-833,Patent Application,no,0,0,1,060-175-261-480-833,CN,1,060-175-261-480-833,CN,0,G06F40/157;;G06F40/18;;G06F40/30;;G06F40/194;;G06Q40/125,G06F40/157;;G06F40/18;;G06F40/194;;G06F40/30;;G06Q40/12,,0,0,,,,PENDING
33,CN,A,CN 118070813 A,092-414-344-569-127,2024-05-24,2024,CN 202311749960 A,2023-12-19,CN 202311749960 A,2023-12-19,Investment decision consultation question and answer method and system based on NLP and large language model,"The invention belongs to the technical field of consultation questioning and answering, and discloses an investment decision consultation questioning and answering method and system based on NLP and a large language model. The method comprises the following steps: acquiring a plurality of historical investment decision knowledge data; constructing an investment decision knowledge graph and an investment decision heterogeneous information network by using an NLP algorithm; generating an investment decision consultation training sample set and a historical investment decision heterogeneous information network diagram; constructing an investment decision consultation question and answer model by using a large language model algorithm, and constructing an investment decision evaluation model; collecting real-time investment decision consultation problem data, and performing problem correction; an investment decision consultation answer is made; generating a real-time investment decision heterogeneous information network diagram; performing investment decision evaluation; and outputting the investment decision consultation answer data with the highest investment decision score. The problems of poor answering accuracy, low efficiency, high cost input, low model training speed and poor use experience in the prior art are solved.",CHINA UNION INTERNATIONAL ENGINEERING MAN CO LTD,XU XIAOZHENG;;LI DONGSHENG,,https://lens.org/092-414-344-569-127,Patent Application,no,4,3,2,092-414-344-569-127;;077-076-396-689-638,CN,2,092-414-344-569-127;;077-076-396-689-638,CN,0,G06F40/35;;G06F40/289;;G06F40/284;;G06F40/205;;G06F16/3329;;G06N3/045;;G06N3/0464;;G06N3/0442;;G06N3/08,G06F40/35;;G06F16/332;;G06F40/205;;G06F40/284;;G06F40/289;;G06N3/0442;;G06N3/045;;G06N3/0464;;G06N3/08,,0,0,,,,ACTIVE
34,CN,A,CN 117744804 A,106-408-859-007-743,2024-03-22,2024,CN 202410182916 A,2024-02-19,CN 202410182916 A,2024-02-19,"Financial analysis task reasoning method based on large language model, terminal and medium","The invention discloses a financial analysis task reasoning method based on a large language model, a terminal and a medium. The method comprises the steps of identifying a financial analysis task, extracting financial keywords of the financial analysis task based on the large language model, and obtaining financial knowledge information corresponding to the financial keywords; determining a target analysis tool based on the financial keyword and the financial knowledge information, and determining a target calculation result corresponding to the financial analysis task based on the target analysis tool; and on the basis of the financial knowledge information, the target analysis tool and the target calculation result, synthesizing prompt, and performing reasoning interpretation on the financial analysis task by the large language model according to the prompt. According to the method, the financial knowledge information corresponding to the financial keywords is retrieved and obtained in the financial knowledge base based on the financial keywords extracted by the large language model, so that a more accurate target analysis tool is obtained, and reasoning calculation of the financial analysis task is performed based on the target analysis tool; therefore, the calculation accuracy and credibility of the financial analysis task are improved.",YUEGANG AODAWAN DIGITAL ECONOMIC RES INSTITUTE FUTIAN,XU CHENGJIN;;YANG CEHAO;;LU HAO;;QI YIYAN;;LIN ZHOUCHI;;GUO JIAN,,https://lens.org/106-408-859-007-743,Patent Application,no,2,5,1,106-408-859-007-743,CN,1,106-408-859-007-743,CN,0,Y02D10/00,G06N5/04;;G06F18/22;;G06F40/295;;G06N5/022;;G06Q40/00,,2,0,,,"杨纪成: ""《互联网软件应用于开发》"", 30 September 2006, 经济科学出版社, pages: 209 - 210;;曹雷 等: ""《指挥信息系统》"", 31 January 2012, 国防工业出版社, pages: 71",PENDING
35,CN,A,CN 119990752 A,122-729-811-233-642,2025-05-13,2025,CN 202510063935 A,2025-01-15,CN 202510063935 A,2025-01-15,Enterprise financial risk early warning method based on large language model and Logistic model,"The invention discloses an enterprise financial risk early warning method based on a large language model and a Logistic model, and belongs to the technical field of computer natural language processing, and the method comprises the following steps: S1, respectively collecting text data of an annual performance description of a (t-2) th year and one-quarter, half-year and three-quarter performance description of a (t-1) th year of a listed company, collecting financial data of the (t-1) th year; s2, respectively calculating a text sentiment value, text readability and text similarity for a management layer text on a performance description meeting, and calculating question and answer correlation for a dialogue text between a management layer and an investor; and S3, predicting whether the listed companies are subjected to ST processing or not by using a Logistic model by using company financial data in combination with the text sentiment values, the text readability, the text similarity and the question and answer correlation. According to the method, the financial risk of the listed company can be predicted more comprehensively and accurately from multiple dimensions.",UNIV YANSHAN,GONG JIBING;;YE TIANXIANG;;WU JIAJUN;;LIN TIANYU;;LOU HANGYU;;JU JINGXIN;;ZHOU CHAO;;DU SHUYING;;ZANG QIAN,,https://lens.org/122-729-811-233-642,Patent Application,no,0,0,1,122-729-811-233-642,CN,1,122-729-811-233-642,CN,0,,G06Q10/0635;;G06N5/04;;G06Q10/04;;G06Q40/12,,0,0,,,,PENDING
36,CN,A,CN 120688024 A,186-228-634-514-932,2025-09-23,2025,CN 202510794158 A,2025-06-13,CN 202510794158 A,2025-06-13,Financial activity information mining system and method based on multiple base large language models,"The invention provides a financial activity information mining system and method based on a plurality of base large language models, and relates to the technical field of big data processing, and the method comprises the steps: employing a plurality of base large language models to carry out entity recognition and mining on an input financial information text, and obtaining a plurality of financial information entities; performing entity relationship identification and mining on the financial information text and the financial information entities to obtain entity relationships among the financial information entities; and arranging the financial information text, the financial information entities corresponding to the financial information text and the corresponding entity relationships into a chart according to the corresponding relationships, and displaying the chart. The method has the advantages that multiple base large language models are adopted for entity recognition and mining and relation extraction between entities, the recognition efficiency can be improved, the financial activity service accuracy requirement is met, and the problem that in the prior art, analysis of financial activity entities and incidence relations often depends on a manual mode, and the analysis efficiency is poor is solved. The efficiency is low; and important information is easy to miss.",THIRD RES INST MINISTRY PUBLIC SECURITY,ZHU TONG;;HU LINGLING;;LENG JIACHEN,,https://lens.org/186-228-634-514-932,Patent Application,no,0,0,1,186-228-634-514-932,CN,1,186-228-634-514-932,CN,0,,G06F18/26;;G06F40/186;;G06F40/295;;G06F40/30;;G06N5/025;;G06N5/04,,0,0,,,,PENDING
37,CN,A,CN 120723866 A,174-158-471-757-668,2025-09-30,2025,CN 202510815804 A,2025-06-18,CN 202510815804 A,2025-06-18,Financial mixed data intelligent question and answer method and system based on large language model,"The invention discloses a financial mixed data intelligent question and answer method and system based on a large language model. The method relates to the technical field of mixed data intelligent question answering and comprises the steps that 1, TAT-QA data is acquired, and an analogy sample data set is constructed by using data in a TAT-QA development set; 2, constructing an analogy sample vector library by using the analogy sample data set; 3, using data in the TAT-QA training set to construct a supervised fine tuning training data set with an analogy sample; 4, training the intelligent question and answer model by using a supervised fine tuning method; and 5, constructing a reasoning pipeline, and completing an intelligent question and answer task. According to the method, localization deployment can be easily carried out, and data use is safer; the workload of document analysts is reduced; and the working efficiency of the document analysts is improved.",UNIV BEIJING INF SCI & TECH;;TOPWALK NETWORK SECURITY INFORMATION TECH CO LTD;;TRS INFORMATION TECH CO LTD,LIU XIULEI;;JIANG YURU;;WANG RUOFAN;;WANG HONGJUN;;HAN JINXIA,,https://lens.org/174-158-471-757-668,Patent Application,no,0,0,1,174-158-471-757-668,CN,1,174-158-471-757-668,CN,0,,G06F16/3329;;G06N3/09;;G06N5/04,,0,0,,,,PENDING
38,KR,A,KR 20230143689 A,110-535-661-498-803,2023-10-13,2023,KR 20220042621 A,2022-04-06,KR 20220042621 A,2022-04-06,Financial service provision system using chatbot,"The present invention relates to a financial service provision system using a chatbot, and more specifically, to a financial service provision system using a chatbot, which links an existing messenger application installed on a user terminal with a financial service system using a chatbot, so that financial services can be provided by having a conversation with the chatbot through the messenger application.",NLLN CO LTD,CHOI JIN HEE;;KIM DONG HYUN;;JO HYUN DONG;;SEO GUN IL;;SO WON JEONG;;PARK DO WON,,https://lens.org/110-535-661-498-803,Patent Application,no,1,1,1,110-535-661-498-803,KR,1,110-535-661-498-803,KR,0,G06Q40/02;;H04L51/02;;G06Q30/0281;;G06F40/35;;G06N20/00;;G06Q50/50,G06Q40/02;;G06F40/35;;G06N20/00;;G06Q30/02;;G06Q50/30;;H04L51/02,,0,0,,,,PENDING
39,US,A1,US 2025/0315824 A1,183-057-903-878-636,2025-10-09,2025,US 202418625789 A,2024-04-03,US 202418625789 A,2024-04-03,SYSTEMS AND METHODS FOR EMOTIONALLY ADAPTIVE FINANCIAL CHATBOT,"Various examples are directed to systems and methods for emotionally adaptive financial chatbots. A method includes receiving authentication information from a user of the computer system, authenticating the user for a transaction based on the received authentication information, and detecting an abnormal aspect of the transaction based on parameters of the transaction. Upon detecting the abnormal aspect, the method includes determining, using machine learning, an emotional state of the user. The method further includes adapting an interaction style with the user based on the determined emotional state of the user, receiving an input from the user after adapting the interaction style, and implementing additional security requirements for the transaction based on the detected abnormal aspect, the input from the user, and the determined emotional state.",WELLS FARGO BANK NA,KATGERI SUJAY;;KIDAMBI PHANI N,WELLS FARGO BANK N.A (2024-04-04),https://lens.org/183-057-903-878-636,Patent Application,yes,0,0,1,183-057-903-878-636,US,1,183-057-903-878-636,US,0,G06Q20/40145;;G06Q20/384;;G06Q20/386;;G06V40/16;;G06N20/00;;G06N3/044;;G06N3/08;;G06N3/006;;G06N3/045;;G06N3/0442;;G06N3/047;;G06N5/01;;G06N7/01;;G06N3/084;;G06N20/10;;G06N3/088;;G06Q20/401,G06Q20/40;;G06V10/82;;G06V40/16;;G10L15/183;;G10L25/30;;G10L25/63,,0,0,,,,PENDING
40,CN,A,CN 120821912 A,044-685-431-249-264,2025-10-21,2025,CN 202510942515 A,2025-07-09,CN 202510942515 A,2025-07-09,Financial product recommendation method and device based on LLMs,"The invention relates to the field of financial science and technology, and particularly provides a financial product recommendation method and device based on LLMs, and the method comprises the following steps: S1, data integration; s2, deep natural language understanding and knowledge reasoning are carried out by utilizing LLMs; and S3, personalized recommendation. Compared with the prior art, the enterprise demand can be deeply understood, and more accurate recommendation can be provided.",TIANYUAN BIG DATA CREDIT MAN CO LTD,XIE GUOLIANG;;CUI LELE;;LI YANGYUN;;LI YONGWEI;;ZHANG FAN,,https://lens.org/044-685-431-249-264,Patent Application,no,0,0,1,044-685-431-249-264,CN,1,044-685-431-249-264,CN,0,,G06F16/9535;;G06F16/28;;G06F16/36;;G06F40/289;;G06F40/295;;G06N3/045;;G06N5/022;;G06N5/04;;G06Q40/03;;G06Q40/12,,0,0,,,,PENDING
41,CN,A,CN 119377261 A,127-113-650-830-257,2025-01-28,2025,CN 202411444741 A,2024-10-16,CN 202411444741 A,2024-10-16,Method and system for improving accuracy of large language model on financial query problem based on external retrieval,"The invention belongs to the technical field of computers, and particularly relates to a method and system for improving the accuracy of a large language model on financial query problems based on external retrieval. The method comprises the steps of 1, summarizing financial problems; 2, training the large language model based on the summary of the financial query problem in the step 1; 3, the complexity of the financial problem is judged; 4, decomposing the calculation formula into a plurality of sub-formulas based on the judgment in the step 3; step 5, for the sub-formulas decomposed in the step 4, utilizing the big language model trained in the step 2 to obtain final answers of the sub-formulas; and step 6, performing result summation on a summation result in the step 5 according to a calculation formula during decomposition, so that the large language model is automatically solved, and the accuracy of the large language model in financial query is improved. The method is used for solving the problem that a large language model needs a large amount of calculation.",HARBIN INST TECHNOLOGY,ZHAO TIEJUN;;XU BING;;ZHU CONGHUI;;YANG MUYUN;;CAO HAILONG;;ZHI HELU;;ZHONG JUNSHEN;;XIA HESHEN,,https://lens.org/127-113-650-830-257,Patent Application,no,7,1,2,127-113-650-830-257;;161-937-429-545-558,CN,2,127-113-650-830-257;;161-937-429-545-558,CN,0,G06F16/2453;;G06F16/2455;;G06F16/2457;;Y02D10/00,G06F16/2453;;G06F16/2455;;G06F16/2457,,1,0,,,"张治坤等: ""基于事实星座形模型的财务数据仓库"", 武汉大学学报(理学版), vol. 58, no. 1, 31 October 2012 (2012-10-31), pages 251 - 256",ACTIVE
42,CN,A,CN 120146052 A,098-190-828-866-820,2025-06-13,2025,CN 202510303114 A,2025-03-14,CN 202510303114 A,2025-03-14,Intelligent verification and correction method for named entity recognition based on large language model in financial field,"The invention discloses a named entity recognition intelligent verification and correction method based on a large language model in the financial field. In order to overcome the defects of an existing small model named entity recognition method, the invention provides a method based on the combination of a large language model and an NER small model in the financial field to correct a named entity recognition result, and the NER accuracy is improved. According to the technical scheme for verifying and correcting the result of the NER small model by using the financial field language large model, the accuracy and generalization ability of the financial NER can be remarkably improved, and efficient and reliable named entity recognition in a complex and changeable financial text is ensured.",WIND INFORMATION TECH CO LTD,CAI CHANGKUN;;CHU JIAWEN;;YANG KUNPENG,,https://lens.org/098-190-828-866-820,Patent Application,no,0,0,1,098-190-828-866-820,CN,1,098-190-828-866-820,CN,0,G06F40/295;;G06F40/232;;G06F40/216;;G06N5/041,G06F40/295;;G06F40/216;;G06F40/232;;G06N5/04,,0,0,,,,PENDING
43,KR,B1,KR 102555658 B1,073-657-071-950-770,2023-07-13,2023,KR 20220080781 A,2022-06-30,KR 20220080781 A,2022-06-30,STOCK TRADING SYSTEM USING CHATBOT AND METHOD THEREOF,"The present invention relates to a stock trading system using a chatbot which comprises: a chat service system analyzing, when a user inputs text through a chat app, customer intention for the text and transmitting the analyzed customer intention to a stock trading system of a stock company; and a chatbot system generating, when receiving the customer intention, a response using the stock trading system of a stock company, and transmitting a stock transaction corresponding to the response and a stock transaction result screen to the chat app. The chatbot system constructs sentences in a conversational form when transmitting the stock transaction corresponding to the response and the stock transaction result screen to the chat app. Accordingly, the user can conveniently and safely perform stock account opening, stock trading, transaction history inquiry, balance inquiry, and account transfer through conversation with the chatbot through the chat app without using a stock trading app.",NH INVEST & SECURITIES CO LTD,JUNG JAE YUP,,https://lens.org/073-657-071-950-770,Granted Patent,no,3,0,1,073-657-071-950-770,KR,1,073-657-071-950-770,KR,0,,G06Q40/04;;G06F16/332;;G06Q50/30;;H04L51/02,,0,0,,,,ACTIVE
