15,CN,A,CN 120106986 A,070-900-435-911-632,2025-06-06,2025,CN 202510270740 A,2025-03-07,CN 202510270740 A,2025-03-07,Multi-agent financial analysis system and method based on large language model,"The invention relates to the technical field of financial analysis, and discloses a multi-agent financial analysis system and method based on a large language model, and each agent of a multi-role agent module realizes specialized analysis through a field customization LLM; the hybrid communication protocol module integrates a structured report and a natural language dialogue, and the structured report adopts a JSON or XML format; the dynamic coordinator module is configured to dynamically allocate an agent weight according to the difference between the market stage and the confidence coefficient; the interpretability enhancing module is used for outputting an inference logic chain through a natural language generation technology and visually presenting the inference logic chain; and the data fusion and strategy generation module is used for integrating basic surface, emotion, technology and macroeconomic data and generating a dynamic investment strategy. According to the method, by simulating the organization structure and the cooperation process of a real financial analysis team, the multi-source data are integrated, and the interpretable comprehensive investment strategy is generated, so that the efficiency, the depth and the credibility of financial analysis are remarkably improved.",SHANDONG INSPUR SCIENCE RESEARCH INSTITUTE CO LTD,WANG JINGKUN;;DUAN QIANG,,https://lens.org/070-900-435-911-632,Patent Application,no,0,3,1,070-900-435-911-632,CN,1,070-900-435-911-632,CN,0,G06Q40/06;;G06N5/041;;G06N3/042;;G06N5/022;;G06N3/092;;G06N3/045,G06Q40/06;;G06N3/042;;G06N3/045;;G06N3/092;;G06N5/022;;G06N5/04,,0,0,,,,PENDING
16,CN,A,CN 120494979 A,040-897-090-102-449,2025-08-15,2025,CN 202510651862 A,2025-05-20,CN 202510651862 A,2025-05-20,Financial financing planning scheme providing system based on large language model,"The invention relates to the technical field of financial financing, in particular to a financial financing planning scheme providing system based on a large language model, which comprises a market dynamic analysis module, an asset and liability management module, a financing cost evaluation module and a financing planning optimization module. According to the method, deep learning analysis and real-time processing of financial data are realized by combining a natural language generation technology and a BERT model, the analysis capability of market data is greatly improved, and the system can adjust a financing strategy in real time to adapt to market changes by dynamically monitoring market fluctuation and trading volume, so that the decision process is optimized, and the decision efficiency is improved. Compared with the prior art, the accuracy and timeliness of decision making are improved, particularly in a high-fluctuation market environment, accurate analysis of asset and liability management helps a user to understand and manage financial conditions of the user in a refined mode, effective control over the financing cost is ensured through deep risk assessment, and the overall financial safety and sustainability are improved.",ANHUI RUIXUAN SUPPLY CHAIN TECH CO LTD,ZHANG RIJU;;GUAN PENGFEI;;TAN ZHISHEN;;LI NENG,,https://lens.org/040-897-090-102-449,Patent Application,no,0,0,1,040-897-090-102-449,CN,1,040-897-090-102-449,CN,0,,G06Q40/06;;G06N3/045;;G06Q10/04,,0,0,,,,PENDING
17,CN,A,CN 118551006 A,056-345-159-695-701,2024-08-27,2024,CN 202410608764 A,2024-05-16,CN 202410608764 A,2024-05-16,Method and system for answering financial query question based on large language model,"The invention discloses a method and system for answering financial query questions based on a large language model, and relates to the field of artificial intelligence. The problem that although an existing general model can process general tasks, data features and task requirements in a specific vertical field may be greatly different from those in a general field, and a customized large model needs to meet the requirements is solved. According to the scheme, the method comprises the following steps of 1, summarizing financial query questions, analyzing the financial query questions, and summarizing the financial query questions; 2, according to the summarized steps of the financial query questions, constructing fine adjustment data of the financial question answering process; 3, according to the constructed fine tuning data, performing fine tuning on the large language model; and step 4, controlling an output result of the large language model to achieve a result of answering a financial query question. The method is also suitable for the fine tuning field of the large language model in the vertical field, such as the financial field.",XINSILU TECH HARBIN CO LTD,ZHAO TIEJUN;;SHI HUAXING;;ZHU CONGHUI;;ZHANG WENJUN;;ZHI HELU,,https://lens.org/056-345-159-695-701,Patent Application,no,0,1,1,056-345-159-695-701,CN,1,056-345-159-695-701,CN,0,G06F16/3329;;G06F16/338;;G06Q40/125,G06F16/332;;G06F16/338;;G06Q40/12,,0,0,,,,PENDING
18,CN,A,CN 119025544 A,159-620-588-937-973,2024-11-26,2024,CN 202411137846 A,2024-08-19,CN 202411137846 A,2024-08-19,Financial field intelligent data analysis platform based on large language model,"The invention relates to a financial field intelligent data analysis platform based on a large language model, the platform comprises a user input processing layer, a core analysis engine, a data processing layer and a result display layer, user input processing and intention recognition are refined in the user input processing layer, and the understanding accuracy of user requirements is improved; in a core analysis engine, a mixed retrieval strategy is adopted, vector retrieval and keyword retrieval are combined, and a Rerank model is utilized to optimize result sorting, so that the correlation and comprehensiveness of query results are enhanced. Meanwhile, the consistency, the quality and the display effect of the data are ensured in the data processing layer and the result display layer through a standardized data processing flow and diversified display modes, and the requirements of different users are met.",FUJIAN BOSS SOFTWARE CO LTD,YANG QIUYAN;;HU JINFENG;;SONG DONGLIN;;ZHU XUAN;;LYU ZHIFU,,https://lens.org/159-620-588-937-973,Patent Application,no,5,3,1,159-620-588-937-973,CN,1,159-620-588-937-973,CN,0,G06F16/243;;G06F16/2228;;G06F16/248;;G06N3/0455;;G06N3/0499;;G06N3/048;;G06N3/047;;G06N3/08,G06F16/242;;G06F16/22;;G06F16/248;;G06N3/0455;;G06N3/047;;G06N3/048;;G06N3/0499;;G06N3/08,,0,0,,,,PENDING
19,CN,A,CN 119578414 A,188-180-610-128-669,2025-03-07,2025,CN 202411655866 A,2024-11-19,CN 202411655866 A,2024-11-19,Financial case information mining method and system based on large language model,"The invention provides a financial case information mining system and method based on a large language model, and the method comprises the steps: carrying out the preprocessing of a financial case file through a financial law large language model, and carrying out the entity recognition of the preprocessing data through the financial law large language model and a constructed financial law knowledge graph; and the man-machine loopback module intelligently analyzes and determines the entity recognition result, performs entity relationship recognition according to the determined entity recognition result by using a financial law big language model and a financial law knowledge graph, intelligently analyzes and determines the entity relationship recognition result, and outputs the recognized entity and entity relationship. The accuracy and reliability of the identification result are ensured while the identification efficiency is improved, the omission condition of the entity relationship is avoided as far as possible, and the financial case handling accuracy requirement is met.",THIRD RES INST MINISTRY PUBLIC SECURITY,ZHU TONG,,https://lens.org/188-180-610-128-669,Patent Application,no,0,0,1,188-180-610-128-669,CN,1,188-180-610-128-669,CN,0,G06F40/279;;G06N5/022;;G06F16/367;;G06F16/3344,G06F40/279;;G06F16/334;;G06F16/36;;G06N5/022,,0,0,,,,PENDING
20,CN,A,CN 119441404 A,037-492-156-001-023,2025-02-14,2025,CN 202411500027 A,2024-10-25,CN 202411500027 A,2024-10-25,Intelligent financial question-answering system realized based on large language model,"The invention discloses an intelligent financial question and answer system based on a large language model, and relates to the technical field of financial question and answer, the system solves the problems of financial term ambiguity and context ambiguity through cooperative work of a plurality of modules, and the system comprises the following modules: a context recognition module, a query module and a query module, a natural language processing algorithm is combined with a context analysis technology in the financial field to automatically extract context clues in user questions; and a financial term knowledge base module. According to the method, context recognition and a financial term knowledge base are combined, and the accuracy of understanding the term ambiguity and the complex context is improved through the graph neural network. And the intelligent recommendation module dynamically provides personalized financial suggestions by using collaborative filtering and content recommendation algorithms in combination with user history and market data, and performs real-time adjustment. The risk assessment and prompt module assesses risks through a Bayesian network and a logistic regression model, and the adaptive learning module continuously optimizes risk prediction and helps users to avoid financial risks.",HEBEI FINANCE UNIV;;BAODING NUOSEN COMPUTER SOFTWARE DEV CO LTD,LIU CHONG;;ZHANG YAO;;WANG MEI;;PANG HAO,,https://lens.org/037-492-156-001-023,Patent Application,no,0,3,1,037-492-156-001-023,CN,1,037-492-156-001-023,CN,0,G06F16/3329;;G06F16/9536;;G06F16/9535;;G06F16/335;;G06F40/35;;G06F40/205;;G06N3/042;;G06F16/35;;G06N5/04;;G06F18/27;;G06F18/29;;G06N7/01;;G06Q40/06,G06F16/332;;G06F16/335;;G06F16/35;;G06F16/9535;;G06F16/9536;;G06F18/20;;G06F18/27;;G06F40/205;;G06F40/35;;G06N3/042;;G06N5/04;;G06N7/01;;G06Q40/06,,0,0,,,,PENDING
21,CN,A,CN 120450843 A,172-918-963-666-136,2025-08-08,2025,CN 202510447900 A,2025-04-10,CN 202510447900 A,2025-04-10,"Financial service processing method, device and system based on large language model","The embodiment of the invention provides a financial service processing method, device and system based on a large language model, and the method comprises the steps: collecting various data generated in a financial service consulting or handling request process when detecting that a customer initiates a financial service consulting or handling request; preprocessing the collected data, and extracting key information; inputting the preprocessed data and the extracted key information into a pre-trained large language model, identifying the client intention of the client through the large language model, extracting key business elements, performing risk assessment and performing sentiment analysis on the client; and based on the client intention, the key business elements, the risk assessment result and the sentiment analysis result, in combination with business rules and risk strategies preset by the financial institution, carrying out business processing and decision making. Compared with dependence on artificial experience, the financial service processing method and device can rapidly and accurately process financial services, and therefore the financial service quality is improved.",JIANGSU FUTURE NETWORKS GROUP CO LTD,CHEN XIAOBO;;CHEN WENJING;;LI YI,,https://lens.org/172-918-963-666-136,Patent Application,no,0,0,1,172-918-963-666-136,CN,1,172-918-963-666-136,CN,0,,G06Q40/00;;G06F18/10;;G06F18/20;;G06N3/0455;;G06N3/096;;G06N5/04,,0,0,,,,PENDING
22,CN,A,CN 118296155 A,010-015-455-461-925,2024-07-05,2024,CN 202410377491 A,2024-03-29,CN 202410377491 A,2024-03-29,Financial event extraction and analysis method and device based on large language model,"The invention relates to the technical field of natural language processing, in particular to a financial event extraction and analysis method and device based on a large language model. The method comprises the steps that field corpora are acquired, and corpora in various formats are preprocessed; obtaining hierarchical structured event representation through a multi-level element event extraction and storage module, and storing the structured event representation into a database; inputting the preprocessed domain corpus and the structured event into a financial event enriching module to obtain a knowledge-enhanced event representation; inputting the knowledge-enhanced event representation into a financial event analysis module based on a large language model to obtain an analysis result of the event; and inputting the features of the financial products in the analysis result into a knowledge graph retrieval module to obtain a financial product list influenced by the event. According to the method, the deep understanding capability of the large language model is fully utilized, the internal meaning of the financial event is deeply mined, the relevance and potential influence between the events are understood, and deeper event understanding is provided for investors and decision makers.",UNIV BEIJING SCIENCE & TECH,ZHANG DEZHENG;;LIU CONG;;OURAM AZIGOULI;;LI HUI;;CHEN LONG,,https://lens.org/010-015-455-461-925,Patent Application,no,0,2,1,010-015-455-461-925,CN,1,010-015-455-461-925,CN,0,G06F16/367;;G06Q40/00,G06F16/36;;G06Q40/00,,0,0,,,,PENDING
23,CN,A,CN 119417627 A,140-188-629-024-530,2025-02-11,2025,CN 202411458288 A,2024-10-18,CN 202411458288 A,2024-10-18,Financial RPA method and system based on artificial intelligence large language model,"The invention relates to robot process automation, in particular to a financial RPA method and system based on an artificial intelligence large language model, and the method comprises the following steps: obtaining a natural language instruction and a file inputted by a user; converting into a structured instruction set through a large language model; calling a corresponding API interface based on the structured instruction set to trigger the RPA, and transmitting parameters to the RPA; acquiring data for generating a report based on an RPA preset process; sorting and cleaning the data, and transmitting the data to a large language model through an API interface; the large language model carries out report generation based on the data template; and outputting the generated report to the user. Compared with the prior art, the method has the advantages that the obvious defects and deficiencies of the process automation technology in adaptability and natural language processing capacity in the prior art are overcome, the advantages of the artificial intelligence large language model are utilized, the natural language input is accurately understood and processed, and the flexibility and adaptability of the automatic process are improved.",CHINA NUCLEAR EQUIPMENT TECH RESEARCH SHANGHAI CO LTD,LIU YIFEI;;HUANG YUAN;;LIU YIQIAN;;HE BINGYU;;SUN SHUYUAN;;DING CHANG;;LI TIANTIAN;;ZHANG JI;;ZHANG TENGFEI;;XIE HUI;;LIU YUJIA;;YANG JINCHANG;;LIU JUNKAI;;WU YILAI;;BAO ZHENYU,,https://lens.org/140-188-629-024-530,Patent Application,no,0,2,1,140-188-629-024-530,CN,1,140-188-629-024-530,CN,0,G06Q40/125;;G06Q10/10;;G06F40/30;;G06N3/045;;G06F9/451;;G06F16/252;;H04L67/02;;H04L69/162,G06Q40/12;;G06F9/451;;G06F16/25;;G06F40/30;;G06N3/045;;G06Q10/10;;H04L67/02;;H04L69/16,,0,0,,,,PENDING
24,CN,A,CN 117971867 A,012-338-242-546-772,2024-05-03,2024,CN 202410123616 A,2024-01-30,CN 202410123616 A,2024-01-30,Intelligent financial field database interaction method driven by large language model,"The invention discloses an intelligent financial field database interaction method driven by a large language model, and relates to the field of databases, the method comprises the following steps: S1, constructing a language model and training; s2, identifying and analyzing user input information by using a language model; s3, the language model selects a database interaction tool according to an identification result, and queries a database; s4, the database interaction tool returns a query result and stores query data to the intermediate file; s5, repeatedly executing the steps S3 to S4 on the basis of the action chain until the query of all database interaction tools is finished, and outputting a query result through a language model; and S6, replacing the output variable by utilizing the query data in the intermediate file, and returning a result to the user. According to the invention, the threshold of interaction between the user and the database is reduced, and innovation of user interaction is realized.",UNIV SCIENCE & TECHNOLOGY CHINA,ZHOU YI;;HWANG JUN-SUN;;SONG JIANHENG;;CHEN YONGRONG,,https://lens.org/012-338-242-546-772,Patent Application,no,0,1,1,012-338-242-546-772,CN,1,012-338-242-546-772,CN,0,G06F16/2433;;G06F16/248;;G06F8/427;;G06N20/00;;Y02D10/00,G06F16/242;;G06F8/41;;G06F16/248;;G06N20/00,,0,0,,,,PENDING
25,CN,A,CN 119311900 A,087-407-347-677-40X,2025-01-14,2025,CN 202411368101 A,2024-09-29,CN 202411368101 A,2024-09-29,Financial knowledge graph construction method and system based on large language model,"The invention discloses a financial knowledge graph construction method based on a large language model. The method comprises the following steps: S1, constructing a knowledge normal form; s2, text content is processed according to the knowledge normal form constructed in the S1, and an original knowledge graph is generated; s3, analyzing the original knowledge graph obtained in the S2, and performing knowledge fusion to obtain an optimized knowledge graph; and S4, merging and integrating the optimized knowledge graph obtained in the S3 with the existing knowledge graph, and performing alignment processing to generate a final knowledge graph. According to the method, the industrial financial knowledge normal form is constructed, and the text content is analyzed and concluded, so that the processing efficiency of mass financial text data is improved, and the labor demand during financial text data processing is greatly reduced. And meanwhile, knowledge extraction results are merged and aligned, so that the accuracy and regularity of knowledge extraction are remarkably improved. In addition, compatibility with the existing knowledge graph is realized, so that the constructed financial knowledge graph is more comprehensive and accurate, and subsequent data analysis is facilitated.",SHANGHAI HONGZE INFORMATION TECH CO LTD,WANG ZHENGKAI;;LI FANGJIE;;WANG ZHENGSHAN;;CAO YANG,,https://lens.org/087-407-347-677-40X,Patent Application,no,0,1,1,087-407-347-677-40X,CN,1,087-407-347-677-40X,CN,0,G06F16/367;;G06F40/295;;G06F40/30;;G06Q40/00;;G06N5/025,G06F16/36;;G06F40/295;;G06F40/30;;G06N5/025;;G06Q40/00,,0,0,,,,PENDING
26,CN,A,CN 120338395 A,113-276-391-376-819,2025-07-18,2025,CN 202510444806 A,2025-04-10,CN 202510444806 A,2025-04-10,Research and development investment project discrimination method and system based on large language model,"The invention relates to a research and development investment project discrimination method and system based on a large language model, and belongs to the technical field of large language model application. The method comprises the steps of obtaining a research and development investment project field data set, and obtaining a research and development investment project field annotation data set through a preprocessing model according to the research and development investment project field data set; performing candidate keyword judgment through a knowledge graph according to the input project field words to obtain research and development input project field candidate key features; according to the research and development input project field candidate key features, obtaining a research and development input project field knowledge graph through a word graph construction model; according to the research and development investment project field knowledge graph, performing fine tuning on the BERT large language model through an Adapter fine tuning model to obtain a research and development investment project field BERT large language model; and obtaining key features of the research and development investment project through a research and development investment project field BERT big language model according to the research and development investment project field annotation data set. The key features of the research and development investment project are extracted.",STATE GRID SHANGHAI MUNICIPAL ELECTRIC POWER CO;;SHANGHAI JIUZHAN INFORMATION TECH CO LTD,YANG ZIYE;;WU ENQI;;LU QIYU;;ZHANG BIN;;SONG PING;;WANG MENGWEI;;ZHU CHAOJIE;;SHI SONGFENG;;CAI YIZHU;;ZHU ZIXUAN;;ZHU LI;;XIA XINQIAN;;SHAN CHAN;;LI XINYUE;;SHAO RENQIANG;;GAO QIANGQIANG;;PAN HAIYAN;;ZUO MINGJU;;GAO JUN,,https://lens.org/113-276-391-376-819,Patent Application,no,0,1,1,113-276-391-376-819,CN,1,113-276-391-376-819,CN,0,G06Q10/06313;;G06Q10/103;;G06F40/279;;G06F40/30;;G06N5/022;;Y02P90/30,G06Q10/0631;;G06F40/279;;G06F40/30;;G06N5/022;;G06Q10/10,,0,0,,,,PENDING
27,KR,A,KR 20250161168 A,004-031-109-693-435,2025-11-17,2025,KR 20240060384 A,2024-05-08,KR 20240060384 A,2024-05-08,Methods for determining plagiarism between problems using a large language model trading methods thereof and trading systems,"본 발명의 거대 언어모델을 통한 문제간 표절 판단 방법은 API(Application Programming Interface)를 통해 문제의 지문과 풀이 과정, 그리고 관련 프롬프트를 거대 언어모델에 입력하는 제1 단계, 상기 프롬프트에 기반해서 상기 제1 단계에서 입력된 문제의 표절을 예측하는 제2 단계를 포함해 구성된다.",UNIV SEOUL IND COOP FOUND,BYUNGJEONG LEE;;MYOUNG JAE CHOI;;SE YEONG LEE;;EUNSEO JUNG,,https://lens.org/004-031-109-693-435,Patent Application,no,0,0,1,004-031-109-693-435,KR,1,004-031-109-693-435,KR,0,G06F40/30;;G06F40/194;;G06F18/241;;G06F21/105;;G06F21/16;;G06Q50/20;;G06Q30/0641;;G06N3/08;;G06N3/0475,G06F40/30;;G06F18/241;;G06F21/10;;G06F21/16;;G06F40/194;;G06N3/0475;;G06N3/08;;G06Q30/0601;;G06Q50/20,,0,0,,,,PENDING
28,CN,A,CN 117454985 A,030-009-536-428-806,2024-01-26,2024,CN 202311530468 A,2023-11-16,CN 202311530468 A,2023-11-16,Financial industry knowledge graph construction method based on generative large language model,"The invention discloses a financial industry knowledge graph construction method based on a generative large language model, and the method comprises the steps: calling a large language model API or deploying the large language model for knowledge extraction based on external data, and deploying the large language model for knowledge extraction based on internal data. And summarizing internal and external extraction results, introducing knowledge fusion to construct a customized knowledge extraction data set, training and optimizing an internal knowledge extraction model, and importing an extracted triple into an internal graph database to realize knowledge graph construction. According to the method, a knowledge fusion mechanism is introduced, so that the generative model constructs customized training data, and the accuracy and completeness of knowledge graph construction are improved. On the premise that the confidentiality requirement of the financial industry is met, and under the condition that data and computing power resources are limited, a knowledge graph construction scheme which is suitable for an internal scene and can fuse external knowledge is achieved, and the method has the advantages of being low in cost and good in data quality.",BOHAI BANK CO LTD,ZHOU JUN;;LI XUEYONG;;HE HAIQING;;JIANG CHAO,,https://lens.org/030-009-536-428-806,Patent Application,no,0,3,1,030-009-536-428-806,CN,1,030-009-536-428-806,CN,0,G06N5/025;;G06N5/027;;G06N3/0455;;G06N3/08;;G06F16/367;;G06F16/9024,G06N5/025;;G06F16/36;;G06F16/901;;G06N3/0455;;G06N3/08;;G06N5/02,,0,0,,,,PENDING
