44,CN,A,CN 117350253 A,152-716-549-953-104,2024-01-05,2024,CN 202311388756 A,2023-10-25,CN 202311388756 A,2023-10-25,Financial document automatic generation method and system of GPT model architecture,"The invention provides a financial document automatic generation method and system based on a GPT model architecture, and relates to the field of computer systems. Specifically, the method comprises the following steps: inputting characters, tables and image character description in a financial document and characters in an image into a pre-training model, and carrying out feature processing through an embedded network and a self-attention network in the pre-training model to obtain visual representation of an image area in the document image and text representation of the characters; according to the visual representation and/or the text representation, utilizing a supervision strategy to determine a loss value; according to the invention, business scenes of commercial banks can be fully covered, and the generated contract terms can be automatically adapted according to specific businesses. In addition, on the basis, documents commonly used by commercial banks such as bidding documents and industry analysis reports can be automatically generated, and the repeated workload of front-line business personnel of the commercial banks is greatly reduced.",CHINA CITIC BANK CO LTD,LEI GONGMIN,,https://lens.org/152-716-549-953-104,Patent Application,no,0,1,1,152-716-549-953-104,CN,1,152-716-549-953-104,CN,0,G06F40/166;;G06N3/092;;G06N3/0455;;Y02D10/00,G06F40/166;;G06N3/0455;;G06N3/092,,0,0,,,,PENDING
45,US,A1,US 2024/0202687 A1,163-865-257-167-898,2024-06-20,2024,US 202418423428 A,2024-01-26,US 202418423428 A;;US 202117398590 A;;US 202217882916 A;;US 202217985419 A;;US 202218090866 A;;US 202318200663 A;;US 202318368046 A;;US 202418423403 A,2021-08-10,IN-STREAMING APPLICATION FOR FINANCIAL SERVICES FOR LLM-BASED OPERATING SYSTEMS,"A method for preventing and analyzing fraud in financial services includes the steps of: continuously collecting multimodal data from a plurality of independent channels, including visual, auditory, and tactile data; analyzing the multimodal data using a Large Language Model (LLM) based operating system and fraud prevention modules to detect and prevent fraudulent activities; integrating third-party data from external sources to enhance contextual understanding and improve fraud detection accuracy; and communicating with users through any of the modalities to address potential fraud concerns or obtain additional verification.",IWALLET INC,KOLCHIN DMITRIY,IWALLET INC (2024-01-16),https://lens.org/163-865-257-167-898,Patent Application,yes,4,7,1,163-865-257-167-898,US,12,121-070-863-281-399;;095-392-529-497-021;;078-135-077-612-477;;165-544-493-701-189;;163-865-257-167-898;;029-938-586-802-836;;111-470-515-612-104;;156-251-066-885-459;;111-992-727-833-88X;;078-409-898-231-095;;100-551-207-062-353;;037-087-403-607-809,US,0,G06Q20/0855;;G06Q20/407;;G06N3/0455;;G06Q20/3276;;G06Q20/3255;;G06Q20/386;;G06Q20/042;;G06Q20/4016;;G06Q20/3223;;G06Q20/326;;G06Q20/108;;G06N3/0455;;G06Q20/3223;;G06Q20/3276;;G06Q20/105;;G06Q20/108;;G06Q20/042,G06Q20/10;;G06N3/0455;;G06Q20/04;;G06Q20/32,,0,0,,,,PENDING
46,US,A1,US 2024/0169331 A1,165-544-493-701-189,2024-05-23,2024,US 202418423403 A,2024-01-26,US 202418423403 A;;US 202217882916 A;;US 202217985419 A;;US 202218090866 A;;US 202117398590 A;;US 202318200663 A;;US 202318368046 A,2021-08-10,IN-STREAMING APPLICATION FOR FINANCIAL SERVICES FOR LLM-BASED OPERATING SYSTEMS,"A method for conducting multimodal financial transactions is disclosed. The method includes a. analyzing a context window using a Large Language Model (LLM) based operating system to identify multimodal triggers; b. selecting an appropriate payment processing module from a plurality of modules, each associated with different payment methods, based on the identified multimodal triggers; c. initiating a financial transaction utilizing the selected payment processing module; and d. facilitating diverse channels of input and output between the LLM-based operating system and a user through a plurality of modalities.",IWALLET INC,KOLCHIN DMITRIY,IWALLET INC (2024-01-16),https://lens.org/165-544-493-701-189,Patent Application,yes,0,3,1,165-544-493-701-189,US,12,121-070-863-281-399;;095-392-529-497-021;;078-135-077-612-477;;165-544-493-701-189;;163-865-257-167-898;;029-938-586-802-836;;111-470-515-612-104;;156-251-066-885-459;;111-992-727-833-88X;;078-409-898-231-095;;100-551-207-062-353;;037-087-403-607-809,US,0,G06Q20/027;;G06Q20/0855;;G06Q20/407;;G06Q20/3276;;G06Q20/3223;;G06Q20/4015;;G06N3/0475;;G06Q20/108;;G06Q20/042;;G06N3/0455;;G06Q20/3223;;G06Q20/3276;;G06Q20/105,G06Q20/10;;G06N3/0455;;G06Q20/04;;G06Q20/32,,0,0,,,,PENDING
47,CN,A,CN 119294382 A,066-589-493-452-135,2025-01-10,2025,CN 202411058875 A,2024-08-02,CN 202411058875 A,2024-08-02,"Local large language model optimizing and calling method and device suitable for financial report analysis, equipment and storage medium","According to the method for optimizing and calling the local large language model suitable for financial statement analysis, financial statement data on the Internet are distinguished according to industries, the financial index statistical values of the financial statement data are calculated, the industry index library is constructed, and data with industry characteristics are provided. Then, prompt is generated based on the data, and a corresponding financial analysis report is output by using an external large language model. And taking the financial analysis reports as training samples to train a local large language model, so that the trained local large language model can be called to output an analysis result with industry characteristics for financial statement data to be analyzed in an enterprise. The problems that internal sensitive information is easy to leak when an external large language model is directly used for financial report analysis, and the external large language model is difficult to output different financial report analysis results in combination with industry characteristics are solved.",GUANGDONG YUECAI JINKE TECH CO LTD,LI XIAOFENG;;XU GUANMING;;YANG SHIJIE;;LUO YANGZHONG;;ZHU WENHAO;;YAO DONGLIANG,,https://lens.org/066-589-493-452-135,Patent Application,no,4,0,2,066-589-493-452-135;;141-416-128-677-785,CN,2,066-589-493-452-135;;141-416-128-677-785,CN,0,G06F40/20;;G06F40/16;;G06N3/045,G06F40/20;;G06F40/16;;G06N3/045,,0,0,,,,ACTIVE
48,CN,A,CN 118247057 A,060-486-606-776-217,2024-06-25,2024,CN 202410184868 A,2024-02-19,CN 202410184868 A,2024-02-19,Data asset identification and risk early warning system and method based on financial knowledge graph and large language model,"The invention provides a data asset identification and risk early warning system and method based on a financial knowledge graph and a large language model. The system comprises a financial knowledge graph construction module, a large model training module, a financial knowledge graph and large model coordinator, a multi-modal large model data import module and a data asset identification visualization and early warning module. According to the method, by means of the knowledge graph enabling large model (KG4LLM) method, the large model enabling knowledge graph (LLM4KG) method and the knowledge graph and large model fusion (KG + LLM) method, the specialty and normalization of the financial industry knowledge graph are fully utilized, unified characterization is conducted on the financial industry knowledge graph and the large model, and the result accuracy is enhanced; financial industry knowledge maps are combined and applied to a reasoning process, different types of special data assets are recommended according to different business scenes of users, and the users are helped to manage the data assets; automatic early warning is carried out on affected departments or persons in charge, and the effectiveness and risk management and control capability of data asset management of enterprise clients are improved.",GANGJIAOSUO TECH SHENZHEN CO LTD,CHEN DONGYU,,https://lens.org/060-486-606-776-217,Patent Application,no,0,11,1,060-486-606-776-217,CN,1,060-486-606-776-217,CN,0,G06Q40/06;;G06Q40/10;;G06F16/367;;G06N3/092;;G06N5/022;;G06N5/04,G06Q40/06;;G06F16/36;;G06N3/092;;G06N5/022;;G06N5/04;;G06Q40/10,,0,0,,,,PENDING
49,KR,A,KR 20250018952 A,016-851-265-145-026,2025-02-07,2025,KR 20240037322 A,2024-03-18,KR 20240037322 A;;KR 20230099372 A,2023-07-31,INVESTMENT CONSULTATION CHATBOT SERVICE PROVIDING SYSTEM AND METHOD PERFORMING THEREOF,"본 발명의 일실시예를 따르는 소셜 트레이딩 서비스 제공 서버는, 복수의 자산 거래 플랫폼 서버로부터 자산 딜러 별 거래 정보를 수신하여 딜러 정보 데이터베이스에 저장하는 딜러 정보 수집부; 딜러의 거래 정보 중 딜러 액션 정보를 기초로 매입 시점부터 매각 시점까지의 기간을 확인하고 상기 기간의 범위에 따라 자산 딜러의 투자 기간 그룹을 결정하고, 투자 기간 그룹 별로 수익률을 결정하고, 투자 기간 그룹 별로 그룹핑된 자산 딜러를 수익률에 따라 다시 한번 소그룹으로 분류하는 딜러 분류부; 투자 기간 그룹 별로 해당 그룹의 소분류 그룹으로 분류된 자산 딜러가 투자한 자산 종류를 추출하고, 상기 자산 딜러가 투자한 자산의 매입 시점부터 매각 시점 사이에서, 상기 자산의 매입 가격보다 높은 제 1 매도 가능 가격인 제 1 매도 가능 시점을 결정하고, 상기 제1 매도 가능 가격보다 낮지만 상기 매입 가격보다 높은 제 2 매도 가능 가격인 제 2 매도 가능 시점을 결정하고, 상기 제 1 매도 가능 가격에 상기 제 1 매도 가능 시점의 시장 상황에 해당하는 가중치를 적용한 후 평균화하여 제 1 평균 가격을 산출하고, 상기 제 2 매도 가능 가격에 상기 제 2 매도 가능 시점의 시장 상황에 해당하는 가중치를 적용한 후 평균화하여 제 2 평균 가격을 산출하고, 산기 제 1 평균 가격 및 상기 제 2 평균 가격의 차이 및 수익 금액을 비교하여 수익 금액이 높아지는 시점을 딜러 매도 시점으로 예측하는 학습 모델을 생성하는 딜러 별 학습 모델 생성부를 포함하는 것을 특징으로 한다.",ADENA SOFTWARE CO LTD,JUNG SEUNG WOO,,https://lens.org/016-851-265-145-026,Patent Application,no,4,0,4,016-851-265-145-026;;055-122-613-569-971;;060-867-696-159-798;;137-346-134-024-697,KR,4,016-851-265-145-026;;055-122-613-569-971;;060-867-696-159-798;;137-346-134-024-697,KR,0,G06Q40/04;;G06Q40/06;;G06Q10/04;;G06N20/00;;G06Q30/0281;;G06Q50/50;;H04L51/02;;G06Q10/063112;;G06Q30/0619,G06Q40/04;;G06N20/00;;G06Q10/04;;G06Q30/02;;G06Q40/06;;G06Q50/50;;H04L51/02,,0,0,,,,ACTIVE
50,US,A1,US 2025/0335998 A1,086-919-735-980-032,2025-10-30,2025,US 202519192389 A,2025-04-29,US 202519192389 A;;US 202463640226 P,2024-04-30,SYSTEM AND METHOD FOR VALIDATING LLM REPORT CONTENT IN REGULATED FINANCIAL ENVIRONMENTS,"A method, system, and non-transitory computer-readable medium are disclosed for validating financial report content generated through a retrieval-augmented generation (RAG) process utilizing large language models (LLMs). Source financial metrics are retrieved and provided to a first LLM for generating financial report content. A second LLM extracts financial metrics from the report content and compares them to the source financial metrics to detect hallucinated financial metrics. The second LLM may also evaluate the report content for financial advice or compliance violations.",VESTI AI LTD,HURWITZ JONTY;;YANG DEBORAH;;GINSBERG JEFFREY,,https://lens.org/086-919-735-980-032,Patent Application,yes,0,0,1,086-919-735-980-032,US,1,086-919-735-980-032,US,0,G06Q40/06;;G06Q40/06,G06Q40/06,,0,0,,,,PENDING
51,KR,B1,KR 102247407 B1,075-901-673-292-845,2021-05-20,2021,KR 20190097615 A,2019-08-09,KR 20190097615 A,2019-08-09,AI CROSS-BOARDER TRADING PLATFORM BASED ON PRIVATE BLOCKCHAIN AND AI CHATBOT,"본 발명은 프라이빗 블록체인 및 AI 챗봇 기반의 국경 간 거래 플랫폼에 관한 것으로서, 보다 구체적으로는 국경 간 거래 플랫폼으로서, 직구 및 역직구를 포함하는 국경 간 상품 거래를 지원하는 플랫폼 서버; 허가받은 클라이언트의 접근만 허용하는 프라이빗 블록체인 기반의 네트워크로서, 코인 레이어를 포함하여 블록체인 기반 통합 포인트가 발행되는 메인 네트워크; 및 채팅 기반으로 클라이언트로부터 입력된 입력 데이터를 분석하고, 상품을 추천하는 AI 챗봇 서버를 포함하며, 상기 플랫폼 서버는, 상기 메인 네트워크와 연동하여, 해외 제휴 쇼핑몰에서 발급받은 통합 인증키를 이용해, 허가받은 클라이언트의 로그인을 처리하는 통합 로그인 처리 모듈; 직구 및 역직구를 포함하는 국경 간 상품 거래를 위해, 상품 정보를 제공하고, 검색어를 이용한 상품 검색 결과를 제공하는 상품 정보 제공 모듈; 상기 메인 네트워크와 연동하여, 상기 해외 제휴 쇼핑몰에서 클라이언트가 보유한 포인트를 상기 메인 네트워크에서 발행되는 통합 포인트로 환전하는 통합 포인트 모듈; 및 상기 통합 포인트를 포함하는 결제 수단으로 결제를 처리하는 결제 처리 모듈을 포함하는 것을 그 구성상의 특징으로 한다. 본 발명에서 제안하고 있는 프라이빗 블록체인 및 AI 챗봇 기반의 국경 간 거래 플랫폼에 따르면, 프라이빗 블록체인 기반으로 코인 레이어를 포함하는 메인 네트워크를 포함함으로써, 블록체인 기술을 이용해 해외 제휴 쇼핑몰에서 발급받은 통합 인증키를 이용한 통합 로그인을 처리하여, 해외 고객이 간편하게 플랫폼에 접속 가능하도록 하고, 블록체인 기술을 이용해 해외 제휴 쇼핑몰에서 클라이언트가 보유한 포인트를 메인 네트워크에서 발행되는 통합 포인트로 환전하여 해외 고객이 보유 포인트를 자유롭게 사용할 수 있다. 또한, 본 발명에서 제안하고 있는 프라이빗 블록체인 및 AI 챗봇 기반의 국경 간 거래 플랫폼에 따르면, 채팅 기반으로 클라이언트로부터 입력된 입력 데이터를 분석하고 상품을 추천하는 AI 챗봇 서버를 포함함으로써, 언어 장벽 및 시차를 뛰어넘어 24시간 고객 대응이 가능하여 해외 고객의 만족도를 높일 수 있고, 자연어 처리 기술을 이용해 입력 데이터를 분석하고 분석 결과에 따라 개인 맞춤형 상품을 추천함으로써, 추천 상품에 대한 고객의 만족도를 극대화하고 실질적인 구매율을 높일 수 있다.",주식회사 타키온비앤티,강덕호,,https://lens.org/075-901-673-292-845,Granted Patent,no,0,1,2,075-901-673-292-845;;050-970-709-677-467,KR,2,075-901-673-292-845;;050-970-709-677-467,KR,0,G06Q30/0619;;G06Q30/0631;;G06Q40/04;;G06Q50/01;;H04L9/3263;;G06Q50/50;;G06N3/09;;H04L51/02,G06Q30/06;;G06N3/08;;G06Q40/04;;G06Q50/00;;H04L9/32,,0,0,,,,ACTIVE
52,KR,A,KR 20210017807 A,050-970-709-677-467,2021-02-17,2021,KR 20190097615 A,2019-08-09,KR 20190097615 A,2019-08-09,AI CROSS-BOARDER TRADING PLATFORM BASED ON PRIVATE BLOCKCHAIN AND AI CHATBOT,"The present invention relates to a cross-border transaction platform based on a private blockchain and AI chatbot. The cross-border transaction platform comprises a platform server, a main network, and an AI chatbot server. Accordingly, customer satisfaction with a recommended product can be maximized, and an actual purchase rate can be increased.",TACHY ON HOLDINOS CO LTD,KANG DEOK HO,,https://lens.org/050-970-709-677-467,Patent Application,no,6,1,2,075-901-673-292-845;;050-970-709-677-467,KR,2,075-901-673-292-845;;050-970-709-677-467,KR,0,G06Q30/0619;;G06Q30/0631;;G06Q40/04;;G06Q50/01;;H04L9/3263;;G06Q50/50;;G06N3/09;;H04L51/02,G06Q30/06;;G06N3/08;;G06Q40/04;;G06Q50/00;;H04L9/32,,0,0,,,,ACTIVE
53,CN,A,CN 119886082 A,083-268-435-292-97X,2025-04-25,2025,CN 202411763035 A,2024-12-03,CN 202411763035 A,2024-12-03,"Method and device for realizing financial system data asset identification processing based on large language model, processor and readable storage medium thereof","The invention relates to a method for realizing financial system data asset identification processing based on a large language model. The method comprises the following steps: carrying out data preprocessing; constructing a three-section cue word template; introducing retrieval enhancement generation, and performing supplementary description on the integrated data; performing parameter fine tuning on the open source model through low-rank adaptation and noise embedding; obtaining a sensitive data identification expert large model through a distributed training framework; model reasoning is accelerated, and a binary classification result of the sensitive data is obtained. The invention also relates to a device for realizing financial system data asset identification processing based on the large language model, a processor and a computer readable storage medium thereof. By adopting the method and device for realizing financial system data asset identification processing based on the large language model, the processor and the computer readable storage medium thereof, the manual annotation cost is remarkably reduced, the sensitive data identification speed and efficiency are improved, meanwhile, the generalization ability is better, and the method and device are suitable for popularization and application. The application effect of sensitive data identification in the professional financial field can be improved.",GUOTAI JUNAN SECURITIES CO LTD;;UNIV EAST CHINA NORMAL,YU FENG;;SU DING;;LI XIANG;;GUO LIAN;;ZHAO ZEYUAN;;GE QINGQING;;LIU JIN'AO,,https://lens.org/083-268-435-292-97X,Patent Application,no,0,0,1,083-268-435-292-97X,CN,1,083-268-435-292-97X,CN,0,G06F40/18;;G06F40/186;;G06F40/194;;G06F18/22;;G06F18/24;;G06F18/214;;G06Q40/06,G06F40/18;;G06F18/214;;G06F18/22;;G06F18/24;;G06F40/186;;G06F40/194;;G06Q40/06,,0,0,,,,PENDING
54,CN,A,CN 117453865 A,063-170-791-898-096,2024-01-26,2024,CN 202310821809 A,2023-07-05,CN 202310821809 A,2023-07-05,Semantic understanding method and system based on text information of dialogue system in financial field,"The invention provides a semantic understanding method and system based on text information of a dialogue system in the financial field. The semantic understanding method comprises the steps of collecting question text data of a user; preprocessing the text data, and sorting the preprocessed data; respectively constructing a domain identification model according to the sorted data, and determining multi-intention data and corresponding slot position data; constructing a multi-intention recognition and slot extraction multi-task joint model according to the multi-intention data and the corresponding slot data; and respectively iteratively training the field identification model and the multi-task joint model to obtain a field corresponding to the user question text and an intention and a slot position corresponding to each sentence in the user question text, thereby completing semantic understanding of the user question text. Semantic understanding is performed more finely and accurately through factor classification of user questions, dialogue answers are generated, and a dialogue semantic understanding task in the specific financial field is completed. And meanwhile, the problems of poor training timeliness and performance of a traditional cascade model are solved.",SHANGHAI JIUFANGYUN INTELLIGENT TECH CO LTD,CAI ZI,,https://lens.org/063-170-791-898-096,Patent Application,no,0,0,1,063-170-791-898-096,CN,1,063-170-791-898-096,CN,0,G06F16/3329;;G06F16/3344;;G06F40/35;;G06F16/35;;G06N3/045;;G06N3/048;;G06N3/0499,G06F16/332;;G06F16/33;;G06F16/35;;G06F40/35;;G06N3/045;;G06N3/048;;G06N3/0499,,0,0,,,,PENDING
55,CN,A,CN 118195750 A,112-000-618-613-097,2024-06-14,2024,CN 202410441995 A,2024-04-12,CN 202410441995 A,2024-04-12,Enterprise financial risk control decision support method based on DTW-RNN and LLM,"The invention discloses an enterprise financial risk control decision support method based on DTW-RNN and LLM, and mainly relates to the field of financial risk control. Comprising the following steps: cleaning and normalizing enterprise financial data to ensure data quality and consistency; the DTW technology is utilized to align and match data of different time sequences, and the problem of data length inconsistency is solved; combining neural network structures such as DTW, a recurrent neural network (RNN) and a long short-term memory (LSTM) to construct a risk control model; dividing a data set into a training set and a test set, performing model training through a back propagation algorithm, and performing model optimization through methods such as cross validation; and according to a model prediction result, a risk assessment report and decision suggestions are provided for an enterprise, and the enterprise is helped to carry out risk control and decision making. The method has the advantages that the risk management level can be improved, enterprise managers can be helped to better understand and manage risks, and the risk management level is improved.",LI YUXIN,LI CHENXUE;;HU YANDONG;;LI YUXIN;;WU WENJIA;;ZHAO YIN;;DU WENYI;;ZHU MING;;ZHANG XIAOLEI;;PENG SIYING;;ZHU LUYAO;;CHEN XINGXING;;HAN MINGLEI,,https://lens.org/112-000-618-613-097,Patent Application,no,0,1,1,112-000-618-613-097,CN,1,112-000-618-613-097,CN,0,G06Q40/00;;G06F18/10;;G06F18/22;;G06N3/044;;G06N3/0442;;G06N3/084;;G06Q40/03;;G06Q40/06;;G06F2123/02,G06Q40/00;;G06F18/10;;G06F18/22;;G06F123/02;;G06N3/044;;G06N3/0442;;G06N3/084;;G06Q40/03;;G06Q40/06,,0,0,,,,DISCONTINUED
56,US,B1,US 11544807 B1,110-416-960-049-061,2023-01-03,2023,US 202017089388 A,2020-11-04,US 202017089388 A;;US 202063108528 P;;US 201962947374 P;;US 201962931486 P;;US 201962930830 P,2019-11-05,Policyholder setup in secure personal and financial information storage and chatbot access by trusted individuals,"A computer-implement method and computer system may be configured to facilitate policyholder setup in connection with estate handling. An audible or visible chatbot avator or doppelgänger may lead a trustee, beneficiary, or family member through the estate of an impaired or deceased user. A computer system may have been provided with, or gather, sample voice and visual recordings associated with a user that are used to build the chatbot avatar that simulates the user audibly and/or visually. The computer system may have previously prompted the user for necessary items to properly handle their estate, such as information related to financial accounts, loans, insurance policies, etc. and user names and passwords to various electronic accounts.",STATE FARM MUTUAL AUTOMOBILE INSURANCE CO,BREITWEISER EDWARD W;;STEIGERWALD BRIAN A;;BANERJEE SHREETI;;INGRUM LARRY,,https://lens.org/110-416-960-049-061,Granted Patent,yes,15,3,8,022-392-198-652-681;;144-360-063-447-485;;071-541-062-803-683;;193-477-716-977-86X;;110-416-960-049-061;;030-749-705-246-944;;169-063-925-038-201;;130-256-126-137-858,US,8,022-392-198-652-681;;193-477-716-977-86X;;071-541-062-803-683;;030-749-705-246-944;;110-416-960-049-061;;144-360-063-447-485;;169-063-925-038-201;;130-256-126-137-858,US,0,G06Q50/186;;G06Q40/08;;H04L51/02;;G06Q50/01;;G06Q50/186;;G06Q40/08;;H04L51/04;;H04L51/02;;G06Q40/12;;G16H40/67;;G16H10/60;;G06N20/00;;G06F21/6245;;G06Q10/10;;G06Q10/20;;G06Q30/0203;;G06Q40/02;;G06Q50/16;;G07C5/008;;H04L67/12,G06Q40/08;;G06Q50/18;;H04L51/02;;H04L51/04,,3,0,,,"Adrienne Matei, New technology is forcing us to confront the ethics of bringing people back from the dead, Jan. 27, 2017, Quartz Ideas, https://qz.com/896207/death-technology-will-allow-grieving-people-to-bring-back-their-loved-ones-from-the-dead-digitally/, Jul. 10, 2018.;;Sally Abrahms, 3 Great Web Sites for Organizing Estate-Planning Documents, Nov. 1, 2015, Kiplinger's Retirement Report, Nov. 2015, https://www.kiplinger.com/article/retirement/t021-c000-s004-all-documents-in-one-place-online.html, Jul. 10, 2018.;;The chatbot that lets you talk to the dead, Oct. 11, 2016, The Guardian, https://www.theguardian.com/technology/shortcuts/2016/oct/11/chatbot-talk-to-dead-grief, Jul. 10, 2018.",ACTIVE
